"Position","Title","Logo","Post Link","Company","Company Profile","Location","Actively Status","Description","Seniority level","Employment type","Job function","Industries","Time ago"
16,"Data Solutions Engineer","https://media.licdn.com/dms/image/v2/D560BAQEBabhUQ8jvlQ/company-logo_100_100/B56ZfNf2WdHQAQ-/0/1751499368146/evidentdigital_logo?e=2147483647&v=beta&t=NqFcD2dEa10lscxz8fAUCHVBHa8zBWs7f1aExXOEOIk","https://ca.linkedin.com/jobs/view/data-solutions-engineer-at-evismart%E2%84%A2-4424638343?position=16&pageNum=0&refId=ktO13pVJkX38zKIB7Q7lvQ%3D%3D&trackingId=ohK6UX%2B%2FQAhb5llSZCxwfw%3D%3D","EviSmart™","https://ca.linkedin.com/company/evismartdental?trk=public_jobs_topcard-org-name","Vancouver, British Columbia, Canada",,"Establish the single source of truth for customer data. Then use it to get every customer to value, fast.

On-site | Vancouver Office – 675 W Hastings St. 

 

The Problem We're Solving

EviSmart™ has grown fast — data now lives in more places than it used to: the backend that runs the business, the CRM where sales and customer success work, and the data every lab brings with them when they join the platform. Reporting takes more cross-checking than it should, and the data-mapping step in lab onboarding — simple in concept but exacting in practice — doesn't yet leave every lab owning their own setup. This role exists to close that gap: one person who owns making EviSmart's customer data a single source of truth.

 

Why EviSmart

300 people. Two hubs: Vancouver HQ and Manila operations.
145% year-over-year SaaS growth — the market is responding.
28 countries. One platform. The dental industry's Autopilot.
An in-house AI model research and development team building proprietary intelligence.

 

Why This Role, Right Now 

Sales, Customer Success, and go-to-market teams need to open one system and trust what they see — today they can't. And as the platform scales, onboarding has to become a repeatable machine instead of a per-customer rescue effort. These aren't future problems; they're live ones. The first months of this role are deliberately concrete: specific systems, specific deliverables, measured outcomes. But the mandate behind them is bigger — every system the platform adds and every AI capability the company builds will sit on the customer data foundation this person establishes. 

 

What You'll Own

Own — Reconciliation of customer data across systems: pull a clean customer list from the backend into the CRM — no duplicates, no ghost accounts — audit what's already in HubSpot (call logs, deal history, contacts), and make the call on what stays, what gets cleaned, and what gets automated.

Build — A live two-way integration between HubSpot and the backend: data flows automatically, actions trigger from HubSpot, logic stays in the backend.

Establish — One trusted place to generate sales pipeline, retention rate, customer health, and all other sales, customer success, and go-to-market reporting.

Run — Customer onboarding data-mapping sessions directly with labs.

Deliver — A written brief for engineering: where labs hit friction during mapping, what's causing it, and what to fix so labs can complete it independently.

Coordinate — With Customer Success on onboarding sessions and with our contracted HubSpot partner on integration.

Grow — Into the data foundation itself. As the early goals land, the scope expands toward owning and scaling customer onboarding as a repeatable machine — and toward the broader work of making EviSmart's data trustworthy end to end, across every system it touches.

 

What You'll Get

A foundation-level seat: the data layer you build is what sales reporting, customer success, and the platform's AI and analytics ambitions will run on.

Direct customer contact from week one — labs across 28 countries, real workflows, immediate feedback on whether your work holds up.

Concrete goals with real gates: this role is defined by deliverables and measurable outcomes, not vague mandates.
A role built to grow — the scope expands as the foundation you build proves out.
Competitive compensation with salary range disclosed at offer.

 

How We Work

We ship before we're 100% certain. We write things down because we have two offices and memory is lossy. We debate loudly and move without resentment. We treat the customer's real problem as more important than an elegant internal process. If you've spent time waiting for permission to try something obvious — you'll notice the difference here immediately.

 

The Question You're Probably Asking 

""'Is this a CRM admin job?' No. The CRM is where the data problem surfaces first, so it's the first proving ground — but the work is data engineering end to end: cleansing, integration, sync logic, reporting architecture, and reconciling what the backend, the CRM, and the customer's own data each believe is true.""

— EviSmart Talent Team

 

What We Need

Bachelor's degree in Statistics, Computer Science, Data Science, Economics, or a related field.
4–5 years of professional experience in data analysis, data engineering, or solutions/implementation engineering.
Advanced SQL skills (joins, CTEs, window functions, subqueries).
Proficiency in Python for data analysis and workflow automation.
Experience with ETL/ELT pipelines and workflow automation.
Hands-on CRM data experience — auditing, cleansing, deduplication, and data migration. HubSpot strongly preferred.
Systems integration experience — building or maintaining two-way integrations between platforms (APIs, middleware, sync logic).
Familiarity with Git/GitHub for version control and collaboration.
Comfortable running customer-facing working sessions and explaining data configuration to non-technical users.
Able to translate customer friction into clear, actionable briefs for engineering.

Apply today @ Evismart Careers 

Show more","Not Applicable","Full-time","Engineering and Information Technology","Software Development","6 days ago"
17,"Senior Data Engineer","https://media.licdn.com/dms/image/v2/D560BAQFGyRvMVMYqAw/company-logo_100_100/company-logo_100_100/0/1719806995661?e=2147483647&v=beta&t=MFl5gAhOql57jeO012u6H53TDmrXoNTCJXCq8BUpdrg","https://ca.linkedin.com/jobs/view/senior-data-engineer-at-rbc-4402903148?position=17&pageNum=0&refId=ktO13pVJkX38zKIB7Q7lvQ%3D%3D&trackingId=6iadEj7M6LRX4p9%2BKIdsaQ%3D%3D","RBC","https://ca.linkedin.com/company/rbc?trk=public_jobs_topcard-org-name","Vancouver, British Columbia, Canada",,"Job Description

What is the opportunity?

Compliance is a team within Global Functions Technology that deals with trading and employee surveillance, privacy, and risk governance. This position is within the Compliance Technology area of GFT. This role will focus on building high-performance big data applications and analytics platforms.

What will you do?


Develop expertise in the trade surveillance data infrastructure and application portfolio
Design and implement scalable data pipelines, ETL processes, and data integration solutions
Build and optimize data models and database schemas to support business analytics and reporting needs
Collaborate with cross-functional teams to gather requirements and translate them into technical data solutions
Implement data quality frameworks and monitoring to ensure data accuracy and reliability
Provide technical guidance on data architecture, best practices, and emerging technologies
Support production data systems and troubleshoot data-related issues
Document data processes, pipelines, and system architecture


What do you need to succeed?

Must have:


5+ years of hands-on development experience with big data technologies, specifically Spark, Scala, and distributed computing frameworks
Strong programming skills in Scala and Python with experience building production-grade applications
Proven experience working with big data platforms such as Databricks, Snowflake, or Hadoop ecosystem
Knowledge of streaming technologies (Kafka, Spark Streaming) and event-driven architectures
Familiarity with AI-assisted development workflows, including prompt engineering for code generation and the ability to critically evaluate AI-generated code for correctness and security
Solid understanding of data structures, algorithms, and performance optimization for large-scale data processing
Experience with version control, testing frameworks, and CI/CD practices in a collaborative development environment


Nice-to-have:


Experience with kdb+ or time-series databases for financial data
Familiarity with containerization and cloud-native development (Docker, Kubernetes)
Capital Markets/Wealth management and/or regulatory/compliance domain knowledge


What’s in it for you?

We thrive on the challenge to be our best, progressive thinking to keep growing, and working together to deliver trusted advice to help our clients thrive and communities prosper. We care about each other, reaching our potential, making a difference to our communities, and achieving success that is mutual.


A comprehensive Total Rewards Program including bonuses and flexible benefits, competitive compensation, commissions, and stock where applicable
Leaders who support your development through coaching and managing opportunities
Ability to make a difference and lasting impact
Work in a dynamic, collaborative, progressive, and high-performing team
A world-class training program in financial services
Flexible work/life balance options
Opportunities to do challenging work


#TECHPJ

Job Skills

Big Data Management, Cloud Computing, Database Development, Data Mining, Data Warehousing (DW), ETL Processing, Group Problem Solving, Quality Management, Requirements Analysis

Additional Job Details

Address:

745 THURLOW ST:VANCOUVER

City:

Vancouver

Country:

Canada

Work hours/week:

37.5

Employment Type:

Full time

Platform:

TECHNOLOGY AND OPERATIONS

Job Type:

Regular

Pay Type:

Salaried

Posted Date:

2026-04-15

Application Deadline:

2026-06-30

Note: Applications will be accepted until 11:59 PM on the day prior to the application deadline date above

Our Employment Opportunities

At RBC, we are guided by living shared values of Client First, Integrity, Collaboration, Respect and Excellence and winning together as One RBC. We believe an inclusive workplace that has diverse perspectives is core to our continued growth as one of the largest and most successful banks in the world. Maintaining a workplace where our employees feel supported to perform at their best, effectively collaborate, drive innovation, and grow professionally helps to bring our Purpose to life and create value for our clients and communities. RBC strives to deliver this through policies and programs intended to foster a workplace based on respect, belonging and opportunity for all.

Join our Talent Community

Stay in-the-know about great career opportunities at RBC. Sign up and get customized info on our latest jobs, career tips and Recruitment events that matter to you.

Expand your limits and create a new future together at RBC. Find out how we use our passion and drive to enhance the well-being of our clients and communities at jobs.rbc.com</a/span>

RBC is presently inviting candidates to apply for this existing vacancy. Applying to this posting allows you to express your interest in this current career opportunity at RBC. Qualified applicants may be contacted to review their resume in more detail.


Show more","Not Applicable","Full-time","Information Technology","Banking and Financial Services","2 weeks ago"
18,"Staff Data Engineer","https://media.licdn.com/dms/image/v2/D4D0BAQEgQ7M_R89F3A/company-logo_100_100/company-logo_100_100/0/1730481456286/synthesis_health_logo?e=2147483647&v=beta&t=U7AtQxbMntMpoaXsMsaCqtsSQ2IfNjwVsAtJrgkETjY","https://ca.linkedin.com/jobs/view/staff-data-engineer-at-synthesis-health-4362445145?position=18&pageNum=0&refId=ktO13pVJkX38zKIB7Q7lvQ%3D%3D&trackingId=oMTgjXkd4qK2Cufw%2FkeJbw%3D%3D","Synthesis Health","https://ca.linkedin.com/company/synthesis-health?trk=public_jobs_topcard-org-name","Vancouver, British Columbia, Canada",,"Synthesis Health

Who We Are

We're a mission- and values-driven company with tremendous dedication to our customers. Our 100% remote team is dedicated to a common goal – to revolutionize healthcare through innovation, collaboration, and commitment to our core values and behaviors.

About the Opportunity

We are looking for a Staff Data Engineer who serves as the universal data architect for our platform.

In this role, you will bridge the gap between application engineering and data infrastructure. You will possess a ""big picture"" understanding of our entire data ecosystem—OLTP, OLAP, NoSQL, and Relational. You will own the optimization of our high-volume data pipelines, but equally, you will tune the operational databases that power our services and design the warehousing strategies that drive our analytics.

You will be the authority on data physics: defining how we ingest massive bursts of medical information, how we model it for high-performance transactional locking, and how we transform it for analytical querying without friction.

This is a high-leverage leadership role. You will set the standard for data engineering excellence, mentoring Senior engineers and defining the architectural patterns that keep our platform performant as we scale 100x and beyond.

Key Responsibilities

Polyglot Data Architecture & Performance


Universal Store Optimization: You will be the ultimate authority on the performance of our persistent stores. You will tune AlloyDB (PostgreSQL) for complex transactions (OLTP), optimize NoSQL layers, and structure BigQuery for analytical speed (OLAP).
Prevent Congestion & Latency: You will proactively identify and resolve ""hot spots"" in our data architecture. You will design strategies for sharding, partitioning, and active-archiving that ensure our operational systems remain lean while our analytical history grows indefinitely.


High-Volume Pipeline & Ingestion Strategy


Ingestion at Scale: You will architect robust, backpressure-aware pipelines to handle high-throughput ingestion of HL7 and DICOM metadata. You will ensure our systems can absorb bursty traffic without degrading the user experience.
Stream & Batch Convergence: You will design the flows that move data from operational stores to our data warehouse, ensuring freshness and consistency. You will determine when to use real-time streams versus batch processing to balance cost and latency.


Service Design & Data Governance


Define Data Contracts: You will act as a key voice on the Architecture Review Board (ARB), defining the ""rules of the road"" for how microservices interact with the data layer. You will enforce strict data contracts that decouple services from the underlying storage engine.
Mentorship: You will elevate the data engineering capabilities of the entire organization. You will mentor other engineers on advanced query optimization, data modeling (Star Schema vs. 3NF), and the nuances of distributed data consistency.


What We're Looking For


Elite Data Engineering Experience: 8+ years of experience designing and optimizing data-intensive applications. You have a track record of solving hard scaling problems across the entire data lifecycle.
Universal Data Fluency: You have deep expertise across the spectrum: Relational (AlloyDB/PostgreSQL internals, MVCC, locking), NoSQL (Document stores, Key-Value), and Warehousing (BigQuery/Snowflake internals, columnar storage).
Pipeline Proficiency: Expert-level knowledge of building and optimizing data pipelines using tools like Kafka/PubSub, Beam/Dataflow, or dbt. You understand how to handle late data, duplicates, and exactly-once processing.
Service & System Design: You understand how data stores fit into a broader microservices architecture. You can design synchronous vs. asynchronous data access patterns that protect the database from application-layer thundering herds.
Coding Skills: Strong proficiency in Python, Java, SQL. You write clean, maintainable code for infrastructure and data transformation.
Performance Obsession: You have a proven ability to debug complex data performance issues, from tuning query execution plans and resolving lock contention to optimizing high-throughput ingestion pipelines for minimal lag.


Preferred Qualifications


Healthcare Data: Familiarity with the specific challenges of healthcare data (DICOM hierarchy, HL7 message structures) and compliance (HIPAA).
Real-Time Analytics: Experience architecting real-time analytics dashboards or hybrid transactional/analytical workflows.
Migration Experience: Experience leading zero-downtime database migrations or major schema refactors in a 24/7 environment.


Why You Should Join Us


Solve Our Toughest Puzzles: This is a high-leverage role. You will be working on the most impactful technical challenges that are critical to the company's success.
Define the Architecture: You won't just be maintaining a system; you will be a primary author of its future state, with the autonomy to make it happen.
Lead from the Front: This is a chance to establish yourself as a key technical voice in a rapidly growing company.
Competitive Compensation & Benefits: We offer a strong salary, a 100% remote culture, and significant opportunities for growth.


We are a values-driven company. Our values:


Clinical service first.
Collaborate with our customers.
Listen, respect, learn.
Innovate to excel.


The behaviors we look for:


Be nice.
Be creative.
Be honest.
Be helpful.


Compensation and Benefits

Typical salary range for this position is $120,000 - $150,000 (CAD). However, Synthesis participates in location based hiring and salary ranges can be adjusted based on candidate's residence.

Other benefits include, but are not limited to: Medical, Dental, Vision, ""Use as needed"" vacation policy, and participation in our employee option program.
Show more","Not Applicable","Full-time","Information Technology","Hospitals and Health Care","4 months ago"
19,"Lead Data Engineer (Audience Intelligence)","https://media.licdn.com/dms/image/v2/D4E0BAQG2-FudA9Q-Iw/company-logo_100_100/B4EZsCXcJSKYAQ-/0/1765271258816/two_circles_logo?e=2147483647&v=beta&t=Ku6hbNxKnSO1zW8W_AqQOl4i3E-1MhTD0j56wSstig0","https://ca.linkedin.com/jobs/view/lead-data-engineer-audience-intelligence-at-two-circles-4413617923?position=19&pageNum=0&refId=ktO13pVJkX38zKIB7Q7lvQ%3D%3D&trackingId=c8wZBsyGpR19wnKWGGnYmA%3D%3D","Two Circles","https://uk.linkedin.com/company/two-circles?trk=public_jobs_topcard-org-name","Vancouver, British Columbia, Canada","Be an early applicant","Lead Data Engineer (Azure / Databricks / Python)




Who we are

We are Two Circles. We are a Sports & Entertainment Marketing business. We grow audiences and revenues. We do that by knowing fans best. We work with clients to help them understand & influence what their fans are doing - the way fans spend their money, the events that fans attend, the channels fans respond to, the content fans watch and more. And we use the understanding this gives us to help our clients grow. Grow their audiences and grow their revenues - both direct to consumer and business to business revenues. Our platforms and services are trusted by over 900 clients globally, including the English Premier League, Red Bull, UEFA, VISA, the NFL, Nike and Amazon. We are almost 1000 people, based out of 14 offices, and we deliver work for sports and entertainment businesses of all shapes and sizes all over the world.

 

What you will do

We're looking for a talented Data Engineer to join our squad of >100 Data & BI Engineers, working on our Audience Intelligence Platform. You will be helping to build the leading data management and analytics platform for the sports industry. In this role, you'll work with cutting-edge technologies to design, build, and optimize scalable data solutions, enabling teams, leagues, and organizations to unlock the full potential of their data. If you're passionate about data engineering, enjoy collaborating in a fast-paced environment, and want to make an impact in the sports industry, we'd love to hear from you!

 

Your role will be varied and evolve as quickly as you can learn and develop. Your initial duties will involve:


Design, build, and test scalable data platform solutions in Azure, leveraging tools like ADF, Databricks, and Function Apps, using Python.
Develop high-quality data products, ensuring efficiency, reliability, and performance across our data pipelines.
Collaborate closely with product and marketing teams to deliver data-driven insights and solutions that provide high business value.
Write clean, maintainable code following best practices and development frameworks, ensuring robust data engineering standards.
Continuously improve and optimize data workflows, monitoring performance and implementing enhancements to drive innovation.


Requirements



Requirements

You will have experience with the following:

Experience in designing, building, and testing solutions within a data lakehouse environment.
Proficiency in Python and PySpark for data processing and analytics.
Hands-on experience with Azure, preferably ADF, Databricks, and Function Apps.
Familiarity with CI/CD pipelines using Azure DevOps or similar tools.
Ability to work within established development frameworks and adhere to coding standards.
Excellent communication skills, with an ability to articulate blockers and timelines to non-technical stakeholders.

 

While the above skills are important to this role, we believe that attitude and ability to learn new skills are the most important factors for success in this team. If you are missing some of the experience listed above but this sounds like you, we'd love to hear from you.

 

Strong teamwork skills, with a collaborative mindset and desire to learn from others.
Strong SQL skills for querying and managing data.
A proactive attitude with a passion for continuous learning and growth.
High attention to detail and commitment to delivering quality work.
Comfortable working in a fast-paced environment, with the ability to estimate tasks and deliver incremental value effectively.


Benefits



Professional Growth: Work on a variety of projects, enhancing your testing skills across different applications and technologies.

Impactful Work: Play a key role in delivering high-quality solutions that shape the future of the sports and entertainment industries.

Collaborative Environment: Be part of a team that values ideas, fosters a supportive atmosphere, and encourages continuous learning and improvement.

Innovative Culture: Join a company committed to revolutionizing fan and stakeholder engagement through cutting-edge technology.

Equal Opportunity Employer: Two Circles is an equal-opportunity employer. We celebrate diversity and are committed to creating an inclusive environment for all employees.


The range below represents the low and high end of the base salary someone in this role may earn as an employee of Two Circles. Salaries will vary based on various factors including but not limited to professional and academic experience, training, associated responsibilities, and other business and organizational needs. The range listed is just one component of our total compensation package for employees. Salary decisions are dependent on the circumstances of each hire.

Show more","Mid-Senior level","Full-time","Information Technology","Spectator Sports","3 weeks ago"
