"Position","Title","Logo","Post Link","Company","Company Profile","Location","Actively Status","Description","Seniority level","Employment type","Job function","Industries","Time ago"
26,"Senior Data Developer, Analytics & Insights","https://media.licdn.com/dms/image/v2/D560BAQGrSi2UOCdL5g/company-logo_100_100/company-logo_100_100/0/1719952472030/autodesk_logo?e=2147483647&v=beta&t=ejv20VZdhB7hf_u0Lk3oSEZZ9gfuIp9MWUH0ilyn5zs","https://ca.linkedin.com/jobs/view/senior-data-developer-analytics-insights-at-autodesk-4425533240?position=26&pageNum=0&refId=ktO13pVJkX38zKIB7Q7lvQ%3D%3D&trackingId=kV9NiN%2BO4mMON6yBgpyITg%3D%3D","Autodesk","https://www.linkedin.com/company/autodesk?trk=public_jobs_topcard-org-name","Vancouver, British Columbia, Canada","Be an early applicant","Job Requisition ID #

26WD98881

L'affichage de poste en français suivra / The French job posting follows

26WD98881, Senior Data Developer, Analytics & Insights

Position Overview

Autodesk is looking for a talented and motivated Senior Data Developer to join our Platform Strategy & Emerging Technologies (PSET) organization to develop robust and scalable data pipelines using and improving existing platforms, to support data-driven decision-making across the platform initiatives. The successful candidate will drive performance enhancements, build pipelines, and collaborate with analysts, data scientists, stakeholders and other Data Engineering teams across Autodesk. You will work with cutting edge technologies in the big data space.

Responsibilities


Design, develop, automate and maintain scalable, robust and reliable ELT/ETL data pipelines that collect, process and transform large volumes of structure and unstructured data from various sources
Maintain and enhance our existing data architecture to ensure smooth and efficient data flow across platforms
Interface with data peers, product managers and cross-functional stakeholders to gather requirements, sequence work, and document technical solutions
Implement best practices for data quality, integrity and governance, including monitoring, validation and auditing processes to ensure reliable and consistent data availability
Contribute to a team culture that values quality, robustness, and scalability while fostering initiatives and innovation by staying up to date with industry trends and new technologies
Apply an AI-native data engineering mindset by using ML-driven validation, anomaly detection, automated schema evolution, automated data lineage and optimizations for pipeline performance and resource efficiency


Minimum Qualifications


5+ years of data processing and data engineering experience in a fast-paced, large cloud-based infrastructure (AWS experience required)
Hands-on software development experience in Python
Expert understanding of SQL, dimensional modeling, and analytical data warehouses, such as Snowflake, Presto/Hive
Understanding of Data Engineering best practices for medium to large scale production workloads
Knowledge of big data processing frameworks (e.g. Spark, Hadoop)
Expertise with data pipeline orchestration tools, such as Airflow
Familiar with processing semi-structured file formats such as Json or parquet
Team player with good communication skills
Problem solver with excellent written and interpersonal skills
Bachelor’s degree in computer science, data science, or related fields


Preferred Qualifications


Experience with Jinja, Shell scripting, DBT, Spark SQL
Experience developing in Cloud platform using serverless technologies such as AWS glue, lambda, EMR and EKS is a plus
Experience with remote development using AWS SDK is a plus
Experience with both ETL and ELT pipelines, including traditional ETL tools (e.g., Airflow, Talend, Informatica) and modern ELT frameworks (e.g., dbt, Snowflake)
Knowledge of AWS IAM roles, permissions, and best practices for least-privilege access
Experience with Terraform for AWS resource provisioning, including remote state management and security best practices
Hands-on experience with AWS networking (VPC, security groups, cross-account permissions)
REST API design and implementation
Familiarity with containers and infrastructure-as-code principles
Experience with automation frameworks - Git, Jenkins, and Terraform
Master’s degree in computer science, data science, or related fields
Experience with AI-native data engineering technologies, including adoption of MCP (Model, Context, Prompt) related context engineering to optimize data flow for AI-driven tasks
Demonstrated ability to structure data for enhanced AI reasoning, enabling more robust and explainable machine learning workflows
Experience in reducing latency for complex agentic workflows, ensuring efficient real-time processing and responsiveness in AI-powered systems


26WD98881, Développeur de données senior, Analyse et insights

Aperçu du Poste

Autodesk recherche un développeur de données senior talentueux et motivé pour rejoindre notre organisation Platform Strategy & Emerging Technologies (PSET) afin de développer des pipelines de données robustes et évolutifs en utilisant et en améliorant les plateformes existantes, dans le but de soutenir la prise de décision fondée sur les données dans le cadre des initiatives de la plateforme. Le candidat retenu sera chargé d'optimiser les performances, de créer des pipelines et de collaborer avec des analystes, des data scientists, des parties prenantes et d'autres équipes d'ingénierie des données au sein d'Autodesk.

Vous travaillerez avec des technologies de pointe dans le domaine du big data.

Responsabilités


Concevoir, développer, automatiser et maintenir des pipelines de données ELT/ETL évolutifs, robustes et fiables qui collectent, traitent et transforment de grands volumes de données structurées et non structurées provenant de diverses sources
Maintenir et améliorer notre architecture de données existante afin d’assurer un flux de données fluide et efficace entre les plateformes
Collaborer avec les collègues chargés des données, les chefs de produit et les parties prenantes interfonctionnelles pour recueillir les exigences, organiser le travail et documenter les solutions techniques
Mettre en œuvre les meilleures pratiques en matière de qualité, d’intégrité et de gouvernance des données, y compris les processus de surveillance, de validation et d’audit afin de garantir une disponibilité fiable et cohérente des données
Contribuer à une culture d’équipe qui valorise la qualité, la robustesse et l’évolutivité tout en encourageant les initiatives et l’innovation en se tenant informé des tendances du secteur et des nouvelles technologies
Adopter une approche d’ingénierie des données native à l’IA en utilisant la validation basée sur le ML, la détection des anomalies, l’évolution automatisée des schémas, la traçabilité automatisée des données et les optimisations pour améliorer les performances des pipelines et l’efficacité des ressources


Qualifications Minimales


Plus de 5 ans d'expérience en traitement et ingénierie des données au sein d'une grande infrastructure cloud en constante évolution (expérience AWS requise)
Expérience pratique du développement logiciel en Python
Maîtrise approfondie de SQL, de la modélisation dimensionnelle et des entrepôts de données analytiques, tels que Snowflake, Presto/Hive
Compréhension des meilleures pratiques en ingénierie des données pour les charges de travail de production de moyenne à grande échelle
Connaissance des frameworks de traitement du big data (par ex. Spark, Hadoop)
Expertise des outils d’orchestration de pipelines de données, tels qu’Airflow
Maîtrise du traitement de formats de fichiers semi-structurés tels que JSON ou Parquet
Esprit d'équipe et bonnes compétences en communication
Capacité à résoudre les problèmes et excellentes compétences rédactionnelles et relationnelles
Licence en informatique, science des données ou dans un domaine connexe


Qualifications Souhaitées


Expérience avec Jinja, les scripts Shell, DBT et Spark SQL
Une expérience en développement sur une plateforme cloud utilisant des technologies sans serveur telles qu'AWS Glue, Lambda, EMR et EKS est un plus
Une expérience en développement à distance à l'aide du SDK AWS est un plus
Expérience avec les pipelines ETL et ELT, y compris les outils ETL traditionnels (par exemple, Airflow, Talend, Informatica) et les frameworks ELT modernes (par exemple, dbt, Snowflake)
Connaissance des rôles IAM AWS, des autorisations et des meilleures pratiques en matière d'accès avec le principe du privilège minimal
Expérience avec Terraform pour l'approvisionnement en ressources AWS, y compris la gestion d'état à distance et les meilleures pratiques en matière de sécurité
Expérience pratique des réseaux AWS (VPC, groupes de sécurité, autorisations inter-comptes)
Conception et mise en œuvre d'API REST
Connaissance des conteneurs et des principes de l'infrastructure en tant que code
Expérience avec les frameworks d'automatisation : Git, Jenkins et Terraform
Master en informatique, science des données ou dans un domaine connexe
Expérience des technologies d'ingénierie des données natives pour l'IA, y compris l'adoption de l'ingénierie contextuelle liée au MCP (Modèle, Contexte, Invite) pour optimiser le flux de données pour les tâches pilotées par l'IA
Capacité avérée à structurer les données pour améliorer le raisonnement de l'IA, permettant des workflows d'apprentissage automatique plus robustes et explicables
Expérience dans la réduction de la latence pour des workflows agentiques complexes, garantissant un traitement en temps réel efficace et une réactivité optimale dans les systèmes alimentés par l'IA


Learn More

About Autodesk

Welcome to Autodesk! Amazing things are created every day with our software – from the greenest buildings and cleanest cars to the smartest factories and biggest hit movies. We help innovators turn their ideas into reality, transforming not only how things are made, but what can be made.

We take great pride in our culture here at Autodesk – it’s at the core of everything we do. Our culture guides the way we work and treat each other, informs how we connect with customers and partners, and defines how we show up in the world.

When you’re an Autodesker, you can do meaningful work that helps build a better world designed and made for all. Ready to shape the world and your future? Join us!

Salary transparency

Salary is one part of Autodesk’s competitive compensation package. For Canada based roles, we expect a starting base salary between $0 and $0. Offers are based on the candidate’s experience and geographic location, and may exceed this range. In addition to base salaries, our compensation package may include annual cash bonuses, commissions for sales roles, stock grants, and a comprehensive benefits package.

Diversity & Belonging

We take pride in cultivating a culture of belonging where everyone can thrive. Learn more here: https://www.autodesk.com/company/diversity-and-belonging

Are you an existing contractor or consultant with Autodesk?

Please search for open jobs and apply internally (not on this external site).
Show more","Mid-Senior level","Full-time","Information Technology","Software Development, Design Services, and IT Services and IT Consulting","3 days ago"
27,"Analytics Architect","https://media.licdn.com/dms/image/v2/C560BAQHktufhhol0aQ/company-logo_100_100/company-logo_100_100/0/1631312542120?e=2147483647&v=beta&t=LAipsEEYVxPvpW_ofGZsfoxxlqvLQf4crEX9B2bJl2E","https://ca.linkedin.com/jobs/view/analytics-architect-at-houle-4420682588?position=27&pageNum=0&refId=ktO13pVJkX38zKIB7Q7lvQ%3D%3D&trackingId=Q5dGCEP6MSEGXQVJLGjeRQ%3D%3D","Houle","https://ca.linkedin.com/company/houle-electric-limited?trk=public_jobs_topcard-org-name","Burnaby, British Columbia, Canada","Be an early applicant","A career that gives you purpose. A company that stands up for you. A team where you can be yourself. Sound too good to be true? This is life at Houle. We believe in empowering communities through local projects that positively impact people's lives. We're a passionate group of people who love collaborating on innovative and challenging projects.

About This Role

We are looking for an Analytics Architect to join the Finance team. This role will help build and improve our analytics foundation as our Finance team expands our enterprise Data & Analytics capability. The Analytics Architect will design, build, and maintain reliable and scalable datasets that support self service reporting, decision-making, automation, and future AI/ML initiatives.

In this role, you will work closely with the business and take ownership of key financial and operational metrics. You will build dependable data pipelines and curated datasets/scalable analytics data products that serve as a single, trusted source of data across the organization. You will play a key role in moving our existing SQL Server data mart to the cloud, bringing in new data sources, and making sure analysts and business users have access to high quality, well structured data to support decision-making.

Our preference is to have this role based in one of our regional offices. However, remote working options are available for the right candidate in Canada.

Here's how your role will strengthen our team.

Your Responsibilities


Partner with AI Solutions, FP&A, and business stakeholders to deliver reliable, business-ready data products
Actively participate in business requirements discussions
Build and maintain data pipelines that integrate information from multiple business systems
Integrate data from different business systems into clean and trusted analytics-ready datasets
Create and maintain curated datasets that serve as the trusted source for company wide KPIs
Implement automated data quality checks and resolve data issues to ensure accuracy and reliability
Use modern engineering practices-including CI/CD, automation, testing, and version control-to build and deliver reliable analytics solutions
Support self service reporting and semantic models in Power BI
Partner with IT to ensure appropriate access controls in place and aligned with enterprise standards


Your Experience And Skills


Post secondary degree in a relevant field (Computer Science, Engineering, Information Systems, Business, Economics) or equivalent practical experience
5+ years of experience in data and analytics engineering and exposure to data architecture design
Strong SQL and Python skills, with experience in Microsoft SQL Server
Experience building data pipelines and integrating data from multiple systems
Experience designing and maintaining analytics or semantic models (e.g., Power BI)
Experience with cloud data platforms (Databricks or Microsoft Fabric preferred)
Experience with CI/CD, source control, and deployment practices (e.g., Azure DevOps)
Strong ability to translate technical concepts for non-technical stakeholders


About Houle

As BC's leading electrical contractor and systems integrator, we believe in delivering safe, reliable power for the future. From hospitals and universities, to airports, shipping terminals and shopping centres, our electrical and technology professionals proudly provide innovative solutions that create value for our customers every day.

Since 1944, we've been dedicated to our craft, committed to quality workmanship, and building teams that thrive. Driven by purpose and connected through collaboration, our focus on people guides our success in delivering some of the most exciting infrastructure projects in the province.

As a certified Great Place to Work, recognized Best Workplaces for Women, and one of Canada's Best Managed companies, we have been recognized for our efforts in creating a safe and inclusive work environment.

Why join our team?


We emphasize having a work-life balance - We embrace work-life balance and offer flexible work arrangements including hybrid work options for eligible roles, and a competitive vacation policy.
Continuous development is a top priority - Whether you're looking for a corporate career or a career in the field, you are supported with access to tools and training for development and growth.
Our employee benefits prioritize your financial, physical, and mental well-being - From RRSP matching to health and wellness reimbursements and additional Houle days off, we've got you covered.
We have many exciting project opportunities - With many projects on the go around BC, we're certain you will find countless ways to bring communities to life.
We have fun! Connection is key at Houle, from industry events to themed office gatherings, we never miss an opportunity to celebrate. Join us for our summer bbqs, potlucks, charity fundraisers, community volunteering, and many more fun events!
A safe space for everyone - We celebrate diversity and are proud to be an equal-opportunity employer. We're committed to diversity and inclusion and strive to foster, cultivate and preserve a culture of belonging for all employees.


Salary range: $110,000 - $130,000 per year plus a competitive total compensation package. Actual salary will be commensurate with experience, skills and overall match to the position offered. Let's chat throughout the hiring process and determine the best fit.

Sound like a match? We'd love to connect.

Please visit https://www.houle.ca/careers and click on the listing for Analytics Architect. The opportunity will remain open until it has been filled.

Connect with us on LinkedIn, Instagram, Facebook, and X!

Houle will not be accepting unsolicited resumes from recruitment firms sent to HR, our managers, or employees directly without a signed agreement within the last 12 months. Unsolicited resumes sent to Houle will not be accepted or obligate our organization to pay any fees if the candidate is hired through alternate contacts.
Show more","Not Applicable","Full-time","Design, Art/Creative, and Information Technology","Construction","2 weeks ago"
