"Position","Title","Logo","Post Link","Company","Company Profile","Location","Actively Status","Description","Seniority level","Employment type","Job function","Industries","Time ago"
39,"AI Engineer","https://media.licdn.com/dms/image/v2/D4E0BAQEzBpbYv53rLQ/company-logo_100_100/B4EZ1KllFSIUAQ-/0/1775072858836/firstwestcu_logo?e=2147483647&v=beta&t=gLTG0D-__LBHVEzkIjKZ_INO2SQeW1K8m5uURH4wJNo","https://ca.linkedin.com/jobs/view/ai-engineer-at-first-west-credit-union-4365925193?position=39&pageNum=0&refId=eQ4YgtbbAAShexQh9mv26g%3D%3D&trackingId=QMqVnW6DSX3dI1%2F3ZymTSw%3D%3D","First West Credit Union","https://ca.linkedin.com/company/firstwestcu?trk=public_jobs_topcard-org-name","City of Langley, British Columbia, Canada",,"Job Description

We are currently seeking a AI Engineer to join our team.

The AI Engineer is responsible for designing, building, and delivering high ‑ quality AI technology solutions, including agentic AI applications, retrieval ‑ based intelligence, automation components, and secure system integrations. This role blends software engineering with modern AI development approaches to create reliable, safe, and scalable capabilities that improve user experience, operational efficiency, and decision ‑ making across the organization.

Here’s what would be included as a part of your typical day


AI Technology Design & Development: Design and implement AI technology solutions, including agent behaviors, retrieval ‑ augmented intelligence, and integration of models into applications and workflows. Build secure and reliable components, and integrations to support AI ‑ driven interactions and decisioning. Apply strong software engineering practices, including testing, performance optimization, telemetry, and documentation
AI Application Implementation: Translate business requirements into functional AI components, ensuring clarity, feasibility, and alignment to enterprise technical standards. Develop and refine prompts, reasoning logic, and decisioning flows within agentic applications. Troubleshoot issues in AI behavior, grounding, retrieval, and integration layers.
Data Access & Retrieval Engineering: Implement secure data access strategies across structured and unstructured sources. Build and maintain retrieval pipelines (e.g., search/query components, embedding ‑ based retrieval, document ingestion pipelines). Ensure data usage aligns with privacy, security, and compliance requirements.
Security, Quality & Compliance: Ensure all AI components adhere to identity and access controls, data security requirements, auditability, and content safety guidelines. Maintain awareness of regulatory expectations (including OSFI and FCAC) as they relate to AI ‑ enabled solutions. Conduct code reviews, implement automated testing, and validate AI outputs for accuracy and safety.
Team Support and Collaboration: Work closely with internal IT groups, including Cyber Security, Data, Cloud Infrastructure, Architecture, Software Development, and IT Operations to ensure successful, secure, and scalable operationalization of AI technology solutions. Partner with business stakeholders, product teams, and subject-matter experts to ensure AI solutions are aligned with desired business outcomes and deliver measurable value.
Research & Continuous Improvement: Stay current with advancements in AI engineering patterns, tooling, and development practices. Recommend improvements to frameworks, automation, and engineering processes to enhance solution reliability and scalability. Participate in internal knowledge ‑ sharing and technical learning activities.


Required Skills, Experience & Qualifications


Bachelor’s degree in computer science, Engineering, or related field.
5 years of experience in software engineering, AI engineering, or related technical roles.
Hands ‑ on experience building production-grade AI components, agent ‑ based workflows, intelligent automation, or retrieval ‑ based systems.
Familiarity with enterprise AI platforms and modern cloud architectures (experience with the Microsoft ecosystem is an asset).
Experience working within regulated environments is preferred
Strong problem ‑ solving skills and the ability to understand complex systems.
Excellent communication and collaboration skills
Able to work effectively with both technical and business teams.
Ability to balance independent execution with teamwork and cross ‑ functional coordination.
Strong attention to detail and focus on quality, security, and long ‑ term maintainability
Strong communication and interpersonal skills.
Experience with interpreting and authoring software architecture documents.
High-energy, “can-do” attitude with strong relationship-building skills.
Strong foundation in software engineering, APIs, distributed systems, and secure integrations.
Proficiency with modern AI development practices (agentic workflows, reasoning design, retrieval ‑ augmented intelligence).
Solid understanding of cloud architectures, identity/security fundamentals, and observability.
Ability to rapidly learn new tools and frameworks in the fast ‑ moving AI ecosystem.
Displays an understanding of risk and risk ownership by being able to demonstrate adherence to policies and procedures.


About Us

What’s in it for you:

First, we strive to make our team members feel genuinely rewarded. You’ll have:


Mental health coverage and resources
Customizable health benefits, as well as topped-up parental leave
Performance-based compensation, employee banking advantages and group RRSP matching
Vacation time and flexible work arrangements to support your lifestyle


We are committed to providing a fair, equitable, and competitive rewards package that reflects the value an individual brings to our organization. The compensation mentioned in this job posting should serve as a guide. The total cash compensation earned may vary based on a variety of factors including bonuses and/or incentives, an individual’s skills and experience, and may correlate with performance in the role.

We also provide and encourage opportunities for our employees to make a meaningful impact. After all, as a credit union we’re powered by giving back—in big ways and through small gestures. That's why we offer employees paid time off to volunteer, partner with thousands of local charities, build long-lasting relationships that help our members get ahead and commit to environmental, social and governance (ESG) practices.

By joining our team, you’ll be able to elevate your potential. Wherever your own purpose leads, we’re here to support you with award-winning in-house training programs, access to LinkedIn Learning, and reimbursement for external courses to help you get ahead.

Take the next step in your career as part of our team. Apply for this opportunity!

Candidates, please note: if you are being considered for this role, you will be required to complete a background check, such as employment verification, credit check and criminal record check.

Diversity, Equity, Inclusion & Belonging

At Tru Cooperative Bank, we embrace diversity regardless of gender identity or expression, sexual orientation, religion, race, ethnicity, age, diverse ability, and any aspect that makes someone unique. Inclusion is woven through our organization, from our employee-led network groups, hiring practices and education programs that address barriers and continually grow our equitable, diverse and inclusive culture.

We encourage people who are from equity-deserving groups to apply for a career with us, including women or non-binary people, persons with diverse abilities, Black, Indigenous Peoples, People of Colour and members of 2SLGBTQIA+ communities.

If an accommodation would help you during the process of applying or interviewing for a career with us, please let us know how we can assist you, whether it’s preparing materials in an alternate format, booking an accessible meeting room or other arrangement.

Your individuality is welcome here.

About Us

We’re a financial cooperative that does things differently. We provide time-tested advice that helps our members feel optimistic about their future, and we offer comprehensive banking solutions that enable people to confidently reach their goals. With the financial strength and extended branch network of a large financial institution, we maintain local connections to our communities and take a unique grassroots approach to service. Our more than 250,000 members and approximately 1,250 employees operate from 45 branches throughout the province of BC, under the Envision Financial, Valley First, Island Savings and Enderby & District Financial brands. Visit firstwestcu.ca for more information on Tru Cooperative Bank.

Please know we appreciate your interest in us but only candidates selected for an interview will be contacted.
Show more","Not Applicable","Full-time","Information Technology","Financial Services","2 months ago"
40,"AI & Automation Engineer","https://media.licdn.com/dms/image/v2/D560BAQEBabhUQ8jvlQ/company-logo_100_100/B56ZfNf2WdHQAQ-/0/1751499368146/evidentdigital_logo?e=2147483647&v=beta&t=NqFcD2dEa10lscxz8fAUCHVBHa8zBWs7f1aExXOEOIk","https://ca.linkedin.com/jobs/view/ai-automation-engineer-at-evismart%E2%84%A2-4388990971?position=40&pageNum=0&refId=eQ4YgtbbAAShexQh9mv26g%3D%3D&trackingId=hQy%2FoQa%2F4tHNJnjdbDbooA%3D%3D","EviSmart™","https://ca.linkedin.com/company/evismartdental?trk=public_jobs_topcard-org-name","Vancouver, British Columbia, Canada",,"Dental workflows still run on manual processes. Build the intelligence that changes that. 

On-site | Vancouver Office – 675 W Hastings St. 

 

The Problem We're Solving

Dental labs and clinics run on fragmented, manual processes — case handoffs, data entry, workflow tracking, quality checks — none of it automated, most of it repeated daily. EviSmart's platform exists to replace that. The AI and automation infrastructure is the engine underneath everything: routing decisions, predictive analytics, intelligent process orchestration. The obstacle isn't ambition — it's execution. Someone needs to own the automation layer end-to-end, from identifying the right processes to deploying production-grade solutions that hold up at scale. That's what this role does.

 

Why EviSmart

300 people. Two hubs: Vancouver HQ and Manila operations.
145% year-over-year SaaS growth — the market is responding.
28 countries. One platform. The dental industry's Autopilot.
An in-house AI model research and development team building proprietary intelligence.

 

Why This Role, Right Now

EviSmart isn't experimenting with AI — it's already embedded in the product and the roadmap depends on it going deeper. The automation layer needs an engineer who can move from strategy to shipped solution: identifying high-value process targets, integrating LLMs and ML models into real workflows, and building the data discipline that makes all of it reliable over time. The 2026 roadmap is aggressive. The opportunity to shape EviSmart's automation foundation — not inherit it — is open right now.

 

A Note from the Team 

“We're not looking for someone to run automation experiments in a sandbox. We need someone who understands the full chain — from messy process to deployed solution — and can move fast without cutting corners on data quality. If you've built automation that actually held up in production, you'll feel at home here.”

— Paolo Kalaw, CEO, EviSmart

 

What You’ll Own 

Lead the identification and prioritization of internal processes ready for automation and AI integration across the organization.
Design and build automation solutions using RPA, ML, and AI agent technologies — from conception through deployment and continuous optimization.
Integrate LLMs and NLP into live workflows to power intelligent decision support, predictive analytics, and process orchestration.
Drive the full automation project lifecycle, ensuring every initiative aligns with EviSmart's AI-first roadmap and business objectives.
Champion data cleaning, governance, and discipline practices across all automation projects — the foundation everything else depends on.
Collaborate cross-functionally with operations, product, and engineering teams to understand workflow needs and deliver measurable impact.

 

What You'll Get

Ownership of EviSmart's automation strategy at a company where AI is a core product differentiator — not a side initiative.
Direct line to product impact: the processes you automate reduce friction for dental professionals in 28 countries.
Production AI tooling from day one: Claude, Cursor, and LLM-powered workflows built in-house.
A research and development team building proprietary models — the infrastructure you need is being built alongside you.
Clear growth path: as EviSmart's automation maturity scales, so does the scope and complexity of this role.
Competitive compensation with salary range disclosed at offer.

 

How We Work

We ship before we’re 100% certain. We write things down because we have two offices and memory is lossy. We debate loudly and move without resentment. We treat the customer’s real problem as more important than an elegant internal process. If you’ve spent time waiting for permission to try something obvious — you’ll notice the difference here immediately.  

 

The Question You're Probably Asking

""EviSmart already has an AI research team. How does this role relate to what they're building? The research team builds the models. This role deploys intelligence into operations. The two are complementary — the research team gives you better tools; you give the research team real-world feedback loops. You're not duplicating what exists. You're the bridge between proprietary AI capability and the workflows that actually run the business. One without the other leaves either models without application, or automation without intelligence.""

— EviSmart Talent Team

 

What We Need

Proven experience with Robotic Process Automation (RPA) in a production environment.
Strong background in Machine Learning for predictive analytics and intelligent decision support.
Hands-on expertise with AI agent technologies, LLMs, and NLP — integration experience, not just theoretical knowledge.
Demonstrated ability to manage the full automation project lifecycle: scoping, building, deploying, and iterating.
Strong understanding of data cleaning, governance, and discipline — you know bad data kills good automation.
Experience integrating diverse technologies into cohesive, maintainable solutions.
Familiarity with process improvement methodologies; dental or healthcare background is a bonus.

 

Apply today @ Evismart Careers 

Show more","Entry level","Full-time","Engineering and Information Technology","Software Development","2 weeks ago"
41,"Senior Machine Learning Researcher","https://media.licdn.com/dms/image/v2/D560BAQFGyRvMVMYqAw/company-logo_100_100/company-logo_100_100/0/1719806995661?e=2147483647&v=beta&t=MFl5gAhOql57jeO012u6H53TDmrXoNTCJXCq8BUpdrg","https://ca.linkedin.com/jobs/view/senior-machine-learning-researcher-at-rbc-4413213316?position=41&pageNum=0&refId=eQ4YgtbbAAShexQh9mv26g%3D%3D&trackingId=wi0WkMvuuAnTC8bKIMKC%2Fg%3D%3D","RBC","https://ca.linkedin.com/company/rbc?trk=public_jobs_topcard-org-name","Vancouver, British Columbia, Canada",,"Job Description

RBC Borealis is looking for an enthusiastic Senior Machine Learning Researcher who's excited by the opportunity of being at the forefront of machine learning technology and working on extremely challenging problems in the financial services industry. As a Senior Machine Learning Researcher, you'll be part of a collaborative team delivering AI projects end to end, covering everything from scoping and defining the AI problem, to data pre-processing and exploration, to prototyping novel algorithmic solutions, to software implementations of machine learning-based products.

At RBC Borealis you'll be joining a team that works directly with leading researchers in machine learning; and you'll have access to rich and massive datasets and to the computational resources that support cutting-edge machine learning R&D.

Your responsibilities include:


Drive Research Strategy: Formulate and lead independent research projects that solve complex, high-impact problems. Define success metrics aligned with both business goals and scientific rigor;
Design & Implement ML Solutions: Architect and deploy scalable ML systems and algorithms. Provide technical guidance to cross-functional teams on implementation and optimization;
Build Organizational Expertise: Mentor junior researchers and engineers. Review research outputs, disseminate knowledge, and foster a culture of innovation;
Establish Thought Leadership: Author peer-reviewed publications, present at top-tier conferences (NeurIPS, ACL, EMNLP, etc.), and position the organization as an AI research leader;
Advise Leadership: Synthesize complex technical and business considerations. Provide clear, actionable recommendations on high-stakes decisions with significant financial or operational impact;
Cultivate Strategic Relationships: Build trusted partnerships across teams and external collaborators to deliver measurable value and shape organizational direction.


You're our ideal candidate if you have:


A Ph.D. degree in Computer Science or a related technical field;
2+ years of experience as a machine learning researcher or engineer in a product-centric environment or equivalent experience;
Deep expertise in machine learning; LLM and NLP experience a plus;
Track record of delivering high-impact ML products from concept to production
Experience mentoring junior technical talent;
Exceptional communication skills—able to translate complex ideas for diverse audiences;
A history of high-quality academic publications (e.g., NeurIPS, ACL, EMNLP, CVPR, ICLR, ICML etc.).


What's in it for you?

Join a team that thinks progressively and works collaboratively. We care about seeing each other reach full potential;

A comprehensive Total Rewards Program including bonuses and flexible benefits, competitive compensation, commissions, and stock options where applicable;

Leaders who support your development through coaching and managing opportunities;

Ability to make a difference and lasting impact from a local-to-global scale.

Job Skills

Collaboration, Communication, Computer Programming, Data Science, Large Language Models (LLMs), Machine Learning (ML)

Additional Job Details

Address:

401 GEORGIA ST W:VANCOUVER

City:

Vancouver

Country:

Canada

Work hours/week:

37.5

Employment Type:

Full time

Platform:

TECHNOLOGY AND OPERATIONS

Job Type:

Regular

Pay Type:

Salaried

Posted Date:

2026-05-06

Application Deadline:

2026-10-05

Note: Applications will be accepted until 11:59 PM on the day prior to the application deadline date above

Our Employment Opportunities

At RBC, we are guided by living shared values of Client First, Integrity, Collaboration, Respect and Excellence and winning together as One RBC. We believe an inclusive workplace that has diverse perspectives is core to our continued growth as one of the largest and most successful banks in the world. Maintaining a workplace where our employees feel supported to perform at their best, effectively collaborate, drive innovation, and grow professionally helps to bring our Purpose to life and create value for our clients and communities. RBC strives to deliver this through policies and programs intended to foster a workplace based on respect, belonging and opportunity for all.

Join our Talent Community

Stay in-the-know about great career opportunities at RBC. Sign up and get customized info on our latest jobs, career tips and Recruitment events that matter to you.

Expand your limits and create a new future together at RBC. Find out how we use our passion and drive to enhance the well-being of our clients and communities at jobs.rbc.com</a/span>

RBC is presently inviting candidates to apply for this existing vacancy. Applying to this posting allows you to express your interest in this current career opportunity at RBC. Qualified applicants may be contacted to review their resume in more detail.
Show more","Not Applicable","Full-time","Other","Banking and Financial Services","1 week ago"
