"Position","Title","Logo","Post Link","Company","Company Profile","Location","Actively Status","Description","Seniority level","Employment type","Job function","Industries","Time ago"
13,"Applied Machine Learning Scientist (Remote)","https://media.licdn.com/dms/image/v2/D4E0BAQFpmO5_TMu93A/company-logo_100_100/company-logo_100_100/0/1724347642479/stackadapt_logo?e=2147483647&v=beta&t=ZOjXVgrtPjPg7JL7VFOaKz_aw8BpEwiqHvSIHhd2V5s","https://ca.linkedin.com/jobs/view/applied-machine-learning-scientist-remote-at-stackadapt-4414214372?position=13&pageNum=0&refId=eQ4YgtbbAAShexQh9mv26g%3D%3D&trackingId=FYtJgDkob7QCnjaWSuecaA%3D%3D","StackAdapt","https://ca.linkedin.com/company/stackadapt?trk=public_jobs_topcard-org-name","Vancouver, British Columbia, Canada",,"StackAdapt is the leading technology company that empowers marketers to reach, engage, and convert audiences with precision. With 465 billion automated optimizations per second, the AI-powered StackAdapt Marketing Platform seamlessly connects brand and performance marketing to drive measurable results across the entire customer journey. The most forward-thinking marketers choose StackAdapt to orchestrate high-impact campaigns across programmatic advertising and marketing channels.

We are searching for a talented Applied Machine Learning Scientist to join our engineering team as we continue to expand our data science efforts. Our platform is connected to thousands of publishers and advertisers worldwide and as a result, we're dealing with millions of requests each second, making billions of decisions. We utilize the latest technologies to solve challenges in traffic, data storage, machine learning, and scalability. Want to learn more about our Data Science Team: https://alldus.com/ie/blog/podcasts/aiinaction-ned-dimitrov-stackadapt/Learn more about our team culture here: https://www.stackadapt.com/careers/data-science Watch our talk at Amazon Tech Talks: https://www.youtube.com/watch?v=lRqu-a4gPuU StackAdapt is a Remote First company, and we are open to candidates located anywhere in North America for this position. This role will remain open until February 20, 2026. Applications will be reviewed on a rolling basis, and the posting will close once the deadline is reached.What you'll be doing:
Innovate ML algorithms to maximize ROI and advertising performance. This ranges from creating entirely new algorithms, to improvements on state-of-the art methods, to development using a deep understanding of classic methods
Write production code, sometimes collaborating with Data Engineers, to implement the novel ML algorithms
Prototype potential algorithms and pipelines, test them using historical data, and iterate to modify based on insights
What you'll bring to the table:
Have a Masters degree or PhD in Computer Science, Statistics, Operations Research, or a related field, with dual degrees a plus.
Have the ability to take an ambiguously defined task, and break it down into actionable steps
Have a comprehensive understanding of statistics, optimization and machine learning
Are proficient in coding, data structures, and algorithms
Enjoy working in a friendly, collaborative environment with others
StackAdapter's Enjoy:
Highly competitive salary
Retirement/ 401K/ Pension Savings globally
Competitive Paid time off packages including birthday's off!
Access to a comprehensive mental health care program
Health benefits from day one of employment
Work from home reimbursements
Optional global WeWork membership for those who want a change from their home office and hubs in London and Toronto
Robust training and onboarding program
Coverage and support of personal development initiatives (conferences, courses, books etc)
Access to StackAdapt programmatic courses and certifications to support continuous learning
An awesome parental leave program
A friendly, welcoming, and supportive culture
Our social and team events!

Please note: Benefits and perks may vary depending on your country of employment and the nature of your engagement. In locations where StackAdapt does not have a legal entity, employment and benefits are administered in accordance with local regulations and partner policies.

StackAdapt is a diverse and inclusive team of collaborative, hardworking individuals trying to make a dent in the universe. No matter who you are, where you are from, who you love, follow in faith, disability (or superpower) status, ethnicity, or the gender you identify with (if you’re comfortable, let us know your pronouns), you are welcome at StackAdapt. If you have any requests or requirements to support you throughout any part of the interview process, please let our Talent team know. We use artificial intelligence (AI) to streamline the resume reviews of candidates and assess their fit based on the criteria outlined in the job posting. We do not use AI to make any final hiring or interview decisions. About StackAdapt We've been recognized for our diverse and supportive workplace, high performing campaigns, award-winning customer service, and innovation. We've been awarded: G2 Top Software for 2026
2026 Best Workplaces™ for Young Talent and in Canada by Great Place to Work®
#1 DSP on G2 and leader in a number of categories including Cross-Channel Advertising To learn more about our privacy practices, please see our Privacy Policy. 
Show more","Not Applicable","Full-time","Other","Technology, Information and Internet","1 week ago"
14,"Machine Learning Scientist","https://media.licdn.com/dms/image/v2/C560BAQFoX5ILXahPfw/company-logo_100_100/company-logo_100_100/0/1630645425908/darkvision_technologies_logo?e=2147483647&v=beta&t=qwcOmI0KX45jjegoJWEtsLugr-ADyjK1KNenxNrsvWo","https://ca.linkedin.com/jobs/view/machine-learning-scientist-at-darkvision-4410663063?position=14&pageNum=0&refId=eQ4YgtbbAAShexQh9mv26g%3D%3D&trackingId=C8ruKNeOc0yPg%2F%2FN4gD%2B2w%3D%3D","DarkVision","https://ca.linkedin.com/company/darkvision-technologies?trk=public_jobs_topcard-org-name","North Vancouver, British Columbia, Canada",,"Your Job

DarkVision is seeking a Machine Learning Scientist to join our Imaging & AI team. You will research, design, and prototype the deep learning architectures that power our automated analysis tools. You will solve complex computer vision challenges to enable interpretation of industrial data at scale.




DarkVision’s ultrasound imaging system collects huge datasets on the order of terabytes, detecting sub-millimetric defects in industrial assets that span hundreds of kilometers. It is essential that we develop algorithms for the automated processing, classification, and visualization of this data. As a Machine Learning Scientist, you will focus on the mathematical and architectural challenges of interpreting this data, and creating models that learn efficient and generalizable representations for real-world industrial applications.




This role is on-site at our North Vancouver, BC HQ, where employees enjoy a wide array of amenities including a fully equipped gym, squash court, steam room, climbing wall, and more!




Our Team

Working in the Imaging & AI team, you will join a multidisciplinary group of scientists and engineers. This team is responsible for early-stage ideation, research, experimentation, and development. You will collaborate closely with other technical members to ensure our models are integrated seamlessly into our products.




What You Will Do

Applied Research & Architecture Design: Research and develop state-of-the-art deep learning architectures to solve large-scale industrial problems. You will target tasks such as object detection, instance segmentation, semantic segmentation, and anomaly detection.
Model Prototyping: Rapidly prototype and validate new model concepts using Python and deep learning frameworks. You will own the experimental phase, ensuring models are statistically valid and effective before collaboration with engineering.
Data Strategy: Work closely with Data Analysts and Data Scientists to explore and organize datasets. You will define the data extraction and preprocessing strategies required to train robust models.
Performance Optimization: Continuously monitor model success metrics and research improvements to increase model robustness and accuracy on challenging, real-world data
Documentation & Knowledge Transfer: Document model architectures, training details, and dataset procedures to ensure reproducibility, and facilitate smooth integration by the engineering team.




Who You Are (Basic Qualifications)

Master’s degree in Computer Science, Electrical Engineering, or a related field; PhD preferred
3+ years of experience developing or researching deep learning models
Proficiency in Python and deep learning frameworks such as PyTorch, JAX, etc.
Ability to design experiments and interpret complex results




What Will Put You Ahead

Experience processing medical or industrial ultrasound images
Publications in top-tier computer vision venues (e.g., CVPR, ICCV)
Experience with self-supervised or unsupervised learning methodologies
Hands-on experience with ML lifecycle management tools like MLFlow, Amazon SageMaker, GPC Vertex AI, etc.
Hands-on experience with orchestration tools like Kubeflow, Prefect, Airflow, etc.
Experience leading or mentoring other scientists or researchers
Ability to work in a fast-paced, self-driven environment
Excellent communication skills to present research findings and write technical reports




General Salary Range

For this role, we anticipate paying $100,000 to $150,000 per year. This role is eligible for variable pay, issued as a monetary bonus or in another form.




At Koch companies, we are entrepreneurs. This means we openly challenge the status quo, find new ways to create value and get rewarded for our individual contributions. Any compensation range provided for a role is an estimate determined by available market data. The actual amount may be higher or lower than the range provided considering each candidate's knowledge, skills, abilities, and geographic location. If you have questions, please speak to your recruiter about the flexibility and detail of our compensation philosophy.




Who We Are

DarkVision Technologies Inc. is a Canada-based tech company disrupting the industrial imaging market since 2013. We have created the world’s most advanced acoustic-based imaging platform. We are packaging it into multiple new product lines, revolutionizing how our clients quantify and visualize the integrity of their critical assets.




Backed by Koch Inc., one of the world’s largest privately held companies, DarkVision’s team of Mechanical, Skunkworks, Electrical, Software, and Machine Learning Engineers is rapidly expanding to meet the demand for the company’s current and upcoming products.




We allow employees to work on cutting-edge technologies that blend science with real-world applications. We invite you to join our team for the exciting journey ahead as we become the global leader in industrial imaging.




At Koch, employees are empowered to do what they do best to make life better. Learn how our business philosophy helps employees unleash their potential while creating value for themselves and the company.




Additionally, everyone has individual work and personal needs. We seek to enable the best work environment that helps you and the business work together to produce superior results.




How To Apply

If you have the above qualifications, we would like to hear from you. We thank all applicants in advance, but please be advised that only those selected for an interview will be contacted.




We are an equal opportunity employer. If you require accommodation or assistance at any time during the application or selection processes, please submit a request by following the directions located in the FAQ section at the bottom of the kochcareers.com webpage.




Successful candidates will be required to complete a criminal background check.







Keywords: Machine Learning Scientist, ML, Computer Vision, Deep Learning, DL, PyTorch, Research, Model, Training, Ultrasound, Image Processing, Algorithm, Neural Networks, CNN, convolutional neural network, supervised learning, unsupervised learning

Show more","Mid-Senior level","Full-time","Research and Engineering","Information Services, Data Infrastructure and Analytics, and Oil and Gas","1 week ago"
15,"Data Scientist (USA & Canada)","https://media.licdn.com/dms/image/v2/C4D0BAQH9yfeo_CFGrw/company-logo_100_100/company-logo_100_100/0/1645387751342/flexdaysolutions_logo?e=2147483647&v=beta&t=36j1a4dRC9G0ojGW0N6bmbvOQs_Mw5NgmWHTtYvQbOw","https://ca.linkedin.com/jobs/view/data-scientist-usa-canada-at-flexday-ai-4395465640?position=15&pageNum=0&refId=eQ4YgtbbAAShexQh9mv26g%3D%3D&trackingId=SlM1iTARz%2BKhS1UezoD%2FdQ%3D%3D","Flexday AI","https://www.linkedin.com/company/flexdaysolutions?trk=public_jobs_topcard-org-name","Vancouver, British Columbia, Canada",,"Location: US or Vancouver, Canada

About The Role

We are seeking a highly skilled Data Science Developer to join our team in either the US or Vancouver, Canada. As a Data Science Developer, you will be responsible for developing and implementing machine learning models and data-driven solutions. This is a very hands-on role that requires a deep understanding of machine learning algorithms and programming skills.

Roles And Responsibilities


Develop and implement machine learning models and data-driven solutions
Work closely with data scientists to understand business requirements and develop solutions
Develop and maintain code for machine learning algorithms and models
Collaborate with software engineers to integrate machine learning models into production systems
Optimize models for accuracy, efficiency, and scalability
Design and implement data pipelines for machine learning models
Identify opportunities for process improvements and efficiency gains in machine learning workflows
Stay up-to-date with the latest developments in machine learning, data science, and programming languages
Ability to travel to the US or Canada as required


Requirements


Bachelor’s /Master’s or Ph.D. degree in Computer Science, Engineering, Physics, Mathematics or Statistics or a related field
3+ years of experience in data science or a related field
Strong programming skills in Python or a similar language
Experience with machine learning frameworks such as TensorFlow, PyTorch, or scikit-learn
Experience with data visualization tools such as Matplotlib or Tableau
Strong understanding of statistics and machine learning algorithms
Experience with cloud platforms such as AWS, GCP, or Azure
Strong problem-solving and troubleshooting skills
Ability to work in a fast-paced environment and meet project deadlines


If you are passionate about data science, have a deep understanding of machine learning algorithms, and are looking for an exciting opportunity to work with a talented team, we would love to hear from you.
Show more","Not Applicable","Full-time","Engineering and Information Technology","Software Development","2 months ago"
16,"Deep Learning Researcher","https://media.licdn.com/dms/image/v2/C560BAQH64QIlSSVbyA/company-logo_100_100/company-logo_100_100/0/1647105818235/picovoice_logo?e=2147483647&v=beta&t=AAoS5Uq3wPLYmlMfR_PekPKav9keEf1N1CdGcCNSM-M","https://ca.linkedin.com/jobs/view/deep-learning-researcher-at-picovoice-4426616970?position=16&pageNum=0&refId=eQ4YgtbbAAShexQh9mv26g%3D%3D&trackingId=tD4WFbkZHh%2B4%2FS1xjJw8vw%3D%3D","Picovoice","https://ca.linkedin.com/company/picovoice?trk=public_jobs_topcard-org-name","Vancouver, British Columbia, Canada",,"A profitable, growing AI startup in Vancouver is seeking Deep Learning Researchers to train and deploy state-of-the-art models into real-world on-device AI products.




We tackle unsolved problems under real constraints. We value originality, speed, and rigor.




What We’re Looking For

Graduate degree in Computer Science, Electrical Engineering, or a related field
Strong understanding of deep learning fundamentals and modern architectures
Strong Python skills
Hands-on experience with PyTorch
Experience in training, evaluating, and improving neural network models




Nice to Have

Experience with C and performance optimization
Experience with CUDA and GPU programming
Experience with on-device or embedded inference
Background in speech recognition, speech synthesis, or speaker recognition
Publications in NeurIPS, ICML, ICLR, INTERSPEECH, ICASSP, or CVPR
Show more","Entry level","Full-time","Engineering and Information Technology","Research Services","20 hours ago"
17,"Founding Machine Learning Engineer","https://media.licdn.com/dms/image/v2/D560BAQEq4xw20hk-iQ/company-logo_100_100/B56ZjF332WG4AQ-/0/1755666415650/ondeckai_logo?e=2147483647&v=beta&t=_y-Dn-uVlq8lkdxk3Byzl5XmZTiRBDK8aua0aA5kDIc","https://ca.linkedin.com/jobs/view/founding-machine-learning-engineer-at-ondeck-ai-yc-s25-4302474742?position=17&pageNum=0&refId=eQ4YgtbbAAShexQh9mv26g%3D%3D&trackingId=96xiCPadsQingpbHOLfyEw%3D%3D","OnDeck AI (YC S25)","https://www.linkedin.com/company/ondeckai?trk=public_jobs_topcard-org-name","Vancouver, British Columbia, Canada",,"We’re looking for a generalist Machine Learning Engineer who loves to build, has strong ML and engineering fundamentals, and has excellent empirical intuition. You should have built something in the past that did not exist before, ideally doing novel (applied) research. We also strongly value experience building machine learning systems and working in early-stage startups.

This will be full time, in person in our Vancouver office. Expect an environment that is fast, highly technical and uncompromising. Ideas move quickly, and we will challenge you to not just keep pace, but set it. You will have the option to move to SF too once we establish there.

Our teams are kept small and agile to limit layers of unnecessary process. Autonomy is expected and in exchange, resources are ready available to support your work.

We are building systems that solve any visual tasks across any domain. You will be core to bringing this to life.

Backed by Y Combinator, our clients span robotics, conservation and national defence agencies.
Show more","Not Applicable","Full-time","Engineering and Information Technology","Software Development","8 months ago"
18,"Data Scientist / ML Engineer (Antarctica Capital)","https://media.licdn.com/dms/image/v2/D560BAQGOVuc4vTSUXA/company-logo_100_100/B56ZXxmhB_GQAQ-/0/1743515161087/earthdailyanalytics_logo?e=2147483647&v=beta&t=YBdFPeXZ90ExEU3fHR6-U57nJgo120EYc-Nydm_GrMM","https://ca.linkedin.com/jobs/view/data-scientist-ml-engineer-antarctica-capital-at-earthdaily-4408027460?position=18&pageNum=0&refId=eQ4YgtbbAAShexQh9mv26g%3D%3D&trackingId=4u0WCkPU03X7wyxqO9J8dw%3D%3D","EarthDaily","https://ca.linkedin.com/company/earthdailyanalytics?trk=public_jobs_topcard-org-name","Vancouver, British Columbia, Canada",,"OPPORTUNITY

We are seeking a highly skilled Data Scientist / Machine Learning Engineer to help design, build, deploy, and maintain scalable machine learning systems within Antarctica Capital as part of the Octantis platform. A key initial area of focus for this role will be deep collaboration with the architect/author of an existing neural network used to predict risk factors associated with bonds. In this capacity you will develop an understanding of the existing modeling techniques; identify opportunities for improvement across model performance, infrastructure, reliability, and cost; and lead implementation of those improvements.

Beyond the initial focus area, this role will have significant opportunities to deliver impactful, value-generating capabilities within the firm and a fast, flexible, agile team on which to work.

KEY RESPONSIBILITIES:

Refactor Neural Network


Collaborate with architect and author of neural network bond risk product to identify areas for improvement
Lead architecture and development effort


Ongoing


Contribute to the design, development, and deployment of firm-wide architecture, norms, policies, infrastructure and methodologies for machine learning activities across multiple company groups
Design, develop, and deploy machine learning models into production environments
Collaborate with data scientists to translate prototypes into production-ready systems
Build and maintain data pipelines, feature stores, and model-serving infrastructure
Evaluate and optimize model performance, latency, and scalability
Implement automated training, testing, and deployment workflows (MLOps)
Monitor models in production and address issues related to drift, performance degradation, or data quality
Conduct code reviews and ensure best practices in ML engineering and software development
Stay current with emerging ML/AI technologies and recommend tools or frameworks that improve team efficiency


Other Duties as Assigned

Experience


4+ years building machine learning models with Python and AWS
Hands-on experience with ML frameworks such as Pytorch and TensorFlow
Experience with ML observability and training platforms/technologies like ML Flow
Proficiency in building and deploying models using cloud platforms such as AWS (e.g. in Fargate)
Solid understanding of algorithms, data structures, and software engineering principles


Preferred:


Experience with data and compute orchestration tools like AWS Step Functions or Apache Airflow
Exposure to large scale data warehousing and query engine technologies like Iceberg and Athena, and to columnar data storage formats like parquet
Experience working with and modernizing legacy software, including migrating from on-prem to cloud-based deployments


Skills / Knowledge

Core Technical Skills (Required):


Tensorflow, Pytorch
Python, Pydantic
AWS Lambda, Fargate, Step Functions, other usual suspects
IaC / CDK Additional Technical Skills


(Highly Valued):


API development with FastAPI


WORKING ENVIRONMENT


Fully remote role open to individuals located in and working from the U.S. and Canada
Agile software development with daily standups and weekly Scrum cadence
Fast-paced environment with need to adapt quickly to time-sensitive deliveries
Working hours: 9:00 AM – 5:00 PM Central Time Monday through Friday (except recognized holidays); be available for a minimum of six (6) hours daily during this period to facilitate collaboration


Your Compensation

Base Salary Range: $145,000-$170,000 CAD annually. This range is based on Vancouver, BC-derived compensation for this role and may differ for other geographies. The selected candidate's compensation will be determined based on multiple factors, including but not limited to job-related skills, experience, education, and location.

Powered by JazzHR

DWTUJ86A0N
Show more","Mid-Senior level","Full-time","Engineering and Information Technology","Internet Publishing","1 month ago"
