"Position","Title","Logo","Post Link","Company","Company Profile","Location","Actively Status","Description","Seniority level","Employment type","Job function","Industries","Time ago"
1,"Machine Learning Engineer","https://media.licdn.com/dms/image/v2/C560BAQGE7xLnjr3E4A/company-logo_100_100/company-logo_100_100/0/1636642033844/sanctuaryai_logo?e=2147483647&v=beta&t=PHTHIh3G7U8JHrCsVwhmYi_rq4TPPTV1M2s3f5qGN7M","https://ca.linkedin.com/jobs/view/machine-learning-engineer-at-sanctuary-ai-4407983839?position=1&pageNum=0&refId=eQ4YgtbbAAShexQh9mv26g%3D%3D&trackingId=lQXQtqCz92x2e4EPy7SJfw%3D%3D","Sanctuary AI","https://ca.linkedin.com/company/sanctuaryai?trk=public_jobs_topcard-org-name","Vancouver, British Columbia, Canada",,"Your New Role and Team

Sanctuary AI, a world leader in building dexterity-driven Physical AI for general purpose robots, is seeking Machine Learning (ML) Engineers to join our team of seasoned engineers, researchers, and scientists who are dedicated to tackling fundamental challenges in robotic perception, dexterous manipulation, planning, and reasoning.

As a member of the ML team, your role will focus on building robust systems for training and running ML policies on robots, and working closely with researchers to implement and deploy novel ML techniques into production. With access to our in-house robotic platforms, you’ll design, test, and refine software that connects state-of-the-art methods to real-world performance. This position offers a unique chance to contribute to both the engineering foundations and applied ML capabilities that drive our robots forward.

As part of this role, you will occasionally travel (typically one to two weeks at a time, several times per year) to collaborate closely with partners and teams in advancing critical projects.

Success Criteria


Collaborate with cross-functional teams to identify opportunities for applying machine learning techniques to solve complex problems.
Design, develop, and deploy machine learning models and algorithms to address specific business needs and challenges.
Implement scalable and efficient software solutions to integrate machine learning models into production systems.
Optimize and fine-tune machine learning algorithms for improved performance and accuracy.
Conduct thorough testing and validation of machine learning models to ensure robustness and reliability.
Stay updated on the latest developments and advancements in machine learning and communicate promising research directions to the team.
Provide technical guidance and mentorship to junior team members.


Qualifications

Your Experience


Master’s degree or Ph.D. in Computer Science, Engineering, Mathematics, or a related field.
3+ years of experience in machine learning methods, with specialization in areas such as reinforcement or imitation learning for dexterous manipulation, computer vision for robotics, or natural language processing.
4+ years of software engineering experience, with a focus on developing and deploying production-grade applications.
Hands-on experience deploying ML models to production.
Proficiency with ML frameworks and libraries (e.g., PyTorch, TensorFlow, scikit-learn).
Experience with ROS2 and parallel computing (e.g., CUDA, OpenMP).
Familiarity with cloud platforms (AWS, Azure, GCP) and distributed computing frameworks (e.g., Spark) is a plus.
Demonstrated experience applying ML techniques in real-world systems is strongly valued. Publications are welcome but not expected for this role.
Familiarity with robotics principles and technologies is highly desirable.


Skills


Strong programming proficiency in Python and C++.
Working knowledge of core machine learning techniques and algorithms (e.g., supervised/unsupervised learning, deep learning, reinforcement learning, natural language processing) and the ability to apply them effectively in software systems.
Ability to optimize and fine-tune ML algorithms for performance and accuracy.
Strong problem-solving skills and the ability to work effectively in a fast-paced, collaborative environment.
Excellent communication skills, with the ability to explain complex technical concepts to non-technical stakeholders.
Leadership and mentorship ability, supporting the growth of junior team members.


Traits


Above all else, a consistently positive attitude and a willingness to do whatever it takes to create robust solutions to complex problems.
Takes ownership and accountability, fostering the same in teammates.
Empathetic listener with conflict resolution capabilities.
Consistent bias for action, communication, and interpersonal savvy.
Self-motivated and able to solve problems independently.
Mission driven and passionate about bringing human-like intelligence to machines.
Show more","Mid-Senior level","Full-time","Engineering and Information Technology","Software Development","2 months ago"
2,"Machine Learning Engineer","https://media.licdn.com/dms/image/v2/D560BAQGmwwo0aq4jVA/company-logo_100_100/company-logo_100_100/0/1723034255614/sap_logo?e=2147483647&v=beta&t=Xf0Eda3lLLNPm9ibOMwYyTyTw9Uv8_Kdf4pKR2i2ECk","https://ca.linkedin.com/jobs/view/machine-learning-engineer-at-sap-4425892758?position=2&pageNum=0&refId=eQ4YgtbbAAShexQh9mv26g%3D%3D&trackingId=xfmqPd4VpxYpZAaVBguwNQ%3D%3D","SAP","https://de.linkedin.com/company/sap?trk=public_jobs_topcard-org-name","Vancouver, British Columbia, Canada",,"We help the world run better

At SAP, we keep it simple: you bring your best to us, and we'll bring out the best in you. We're builders touching over 20 industries and 80% of global commerce, and we need your unique talents to help shape what's next. The work is challenging – but it matters. You'll find a place where you can be yourself, prioritize your wellbeing, and truly belong. What's in it for you? Constant learning, skill growth, great benefits, and a team that wants you to grow and succeed.

As a Machine Learning Engineer, you will work within an international team of other machine learning engineers, data scientists and data engineers to deliver top-grade machine learning-based cloud solutions into production. We solve real-world challenges posed by SAP's customers and product units with a focus on central platform services and infrastructure. You will work with SAP’s internal ML System, build agents and leverage LLMs. SAP has some of the richest data sets available in industry.

What you'll do


Explore, understand, and manage SAP Concur’s data storage systems and machine learning environments
Develop new agents that leverage LLMs, APIs and datasets, including RAG based patterns.
Work with interdisciplinary teams of developers, designers, and business experts to develop solutions with real measurable customer impact.
Help to ensure performance, reliability and ongoing improvement of our data pipelines in continuous collaboration with development teams.
Continuously improve data platform efficiency, cost optimization, and operational excellence.


What you bring


Strong AI/ML skills using Python, and experience using ML techniques to deliver end user industrial strength ML features, shipping to millions of users.
3+ years of AWS experience using numerous AWS Services such as S3, DynamoDB and Redshift.
3+ years of experience of shipping software in a professional software team, using GitHub and CICD pipelines.
Solid understanding of data modeling concepts (fact/dimension modeling, schema design, normalization vs denormalization).
Analytical mindset, curiosity and a drive to produce excellent solutions.
Understanding of practical and privacy concerns surrounding Data and AI development.
Familiarity with data quality frameworks, schema evolution, and metadata management.
Exposure to feature stores or ML data platforms.
Experience working with large-scale, high-volume datasets in production.
Fluency in both written and spoken English

Tech you bring


Mastery of Python and Python libraries for Machine Learning, AI and Python Frameworks such as Pandas.
Strong Experience with SQL or NoSQL databases.
Your own vision on how SAP can be more efficient with both data and ML services in production.
Experience with big data frameworks (Spark, PySpark).
Experience with workflow orchestration tools (Airflow, Step Functions).

Tech you'll learn


Latest development in applied ML and AI in customer-facing products.
Best practices for building functional and compliant ML and AI solutions.

Meet your team

As Intelligent Spend and Business Network, we play a crucial role in addressing our customers' end-to-end procurement, travel and expense, and external workforce needs with visibility and agility across the entire supply chain. Our data science team is a small team with diverse backgrounds which will value your individual contribution as well as your ability to collaborate effectively with the rest of the team to develop powerful and effective ML/AI solutions.

Bring out your best

SAP innovations help more than four hundred thousand customers worldwide work together more efficiently and use business insight more effectively. Originally known for leadership in enterprise resource planning (ERP) software, SAP has evolved to become a market leader in end-to-end business application software and related services for database, analytics, intelligent technologies, and experience management. As a cloud company with two hundred million users and more than one hundred thousand employees worldwide, we are purpose-driven and future-focused, with a highly collaborative team ethic and commitment to personal development. Whether connecting global industries, people, or platforms, we help ensure every challenge gets the solution it deserves. At SAP, you can bring out your best.

We win with inclusion

SAP’s culture of inclusion, focus on health and well-being, and flexible working models help ensure that everyone – regardless of background – feels included and can run at their best. At SAP, we believe we are made stronger by the unique capabilities and qualities that each person brings to our company, and we invest in our employees to inspire confidence and help everyone realize their full potential. We ultimately believe in unleashing all talent and creating a better world.

SAP is committed to the values of Equal Employment Opportunity and provides accessibility accommodations to applicants with physical and/or mental disabilities. If you are interested in applying for employment with SAP and are in need of accommodation or special assistance to navigate our website or to complete your application, please send an e-mail with your request to Recruiting Operations Team: Careers@sap.com.

For SAP employees: Only permanent roles are eligible for the SAP Employee Referral Program, according to the eligibility rules set in the SAP Referral Policy. Specific conditions may apply for roles in Vocational Training.

Qualified applicants will receive consideration for employment without regard to their age, race, religion, national origin, ethnicity, gender (including pregnancy, childbirth, et al), sexual orientation, gender identity or expression, protected veteran status, or disability, in compliance with applicable federal, state, and local legal requirements.

SAP believes the value of pay transparency contributes towards an honest and supportive culture and is a significant step toward demonstrating SAP’s commitment to pay equity. SAP provides the annualized compensation range inclusive of base salary and variable incentive target for the career level applicable to the posted role. The targeted combined range for this position is 77500-166200CAD. The actual amount to be offered to the successful candidate will be within that range, dependent upon the key aspects of each case which may include education, skills, experience, scope of the role, location, etc. as determined through the selection process. Any SAP variable incentive includes a targeted dollar amount, and any actual payout amount is dependent on company and personal performance. A summary of benefits and eligibility requirements can be found by clicking this link: www.SAPNorthAmericaBenefits.com.

Due to the nature of the role, which involves global interactions with SAP entities, as well as with employees and stakeholders in Canada, functional proficiency in English is required for positions based in the Quebec.

AI Usage in the Recruitment Process

For information on the responsible use of AI in our recruitment process, please refer to our Guidelines for Ethical Usage of AI in the Recruiting Process.

Please note that any violation of these guidelines may result in disqualification from the hiring process.

Requisition ID: 454734 | Work Area: Software-Design and Development | Expected Travel: 0 - 10% | Career Status: Professional | Employment Type: Regular Full Time | Additional Locations:


Show more","Not Applicable","Full-time","Engineering and Information Technology","Software Development, IT Services and IT Consulting, and Business Consulting and Services","2 days ago"
3,"Machine Learning Engineer - Sports Technology","https://media.licdn.com/dms/image/v2/D560BAQFFyQkhCndGgQ/company-logo_100_100/company-logo_100_100/0/1728487989468/easports_logo?e=2147483647&v=beta&t=pB_ByOIy5JP6xoZC3P95SWynZh7D1B_SDVtC_lHeVPQ","https://ca.linkedin.com/jobs/view/machine-learning-engineer-sports-technology-at-ea-sports-4416849661?position=3&pageNum=0&refId=eQ4YgtbbAAShexQh9mv26g%3D%3D&trackingId=oE2AvjMPY%2BcC%2FBLdcQy%2Baw%3D%3D","EA SPORTS","https://ca.linkedin.com/company/easports?trk=public_jobs_topcard-org-name","Vancouver, British Columbia, Canada",,"Description & Requirements

Electronic Arts creates next-level entertainment experiences that inspire players and fans around the world. Here, everyone is part of the story. Part of a community that connects across the globe. A place where creativity thrives, new perspectives are invited, and ideas matter. A team where everyone makes play happen.

EA SPORTS is one of the most iconic brands in entertainment – connecting hundreds of millions around the world to the sports they love through a portfolio of industry-leading video games.

EA’s Character Animation Research Team (known as the A-Team) is a small team based in Vancouver, British Columbia, committed to advancing the field of Character Animation in games. Our vision is video-game characters with interesting and believable motion that also provides the speed and responsiveness that make our games exciting. Our technology is shared across multiple games in EA including FC, Madden, NHL, skate. TM, Battlefront, Dragon Age and more.

We are looking for Machine Learning experts with a practical mindset, passionate about creating useful tools and innovative features, eager to see their work impact animators, fellow developers, and millions of gamers, and want to own projects from ideation through productization and successful adoption. Working closely with and reporting to a Senior Machine Learning Engineer, the Machine Learning Engineer will join us in creating intuitive experiences powered by ML, pushing the boundaries of game fidelity and bringing our characters to life!

Your Responsibilities


Invent and build ML-driven solutions for complex problems in character animation, agent behavior, physics simulation, and content generation.
Design and implement production-ready ML systems that respect real-world game development constraints such as performance, tooling, and iteration speed.
Create intuitive, easy-to-use workflows that reduce repetitive manual work while empowering creators to move faster and think bigger.
Give users meaningful creative control over model behavior, making experimentation, iteration, and debugging fast and approachable.
Optimize models and pipelines to minimize training and inference time without sacrificing quality.
Stay current with cutting-edge research in Machine Learning, continuously evaluating how new ideas can be applied to games.
Evaluate, extend, and improve both internal and external ML technologies, pushing them further for game-specific use cases.
Work closely with content creators and software engineers to ensure tools are maintainable, effective, and genuinely enjoyable to use.


Your Qualifications

Please note that you do not need to meet all qualifications to be considered. We encourage you to apply if you can meet most of the requirements and are comfortable opening a dialog to be considered.


A Bachelor’s degree in Computer Science, Applied Math, Statistics, Machine Learning, or equivalent practical experience.
Expert-level proficiency in Python, with deep hands-on experience writing clean, scalable, and high-performance code, including ML frameworks like PyTorch or TensorFlow.
Experience productizing ML solutions, either as standalone applications or production services.
A solid foundation in linear algebra, statistics, 3D transformations, and mathematical optimization.
3-5 years of hands-on Machine Learning experience, with a strong, practical, problem-solving mindset.
The ability to take ideas from research papers to working systems, balancing innovation with usability and performance.
Experience handling large-scale datasets (GBs–TBs).


Pay Transparency - North America

Compensation And Benefits

The ranges listed below are what EA in good faith expects to pay applicants for this role in these locations at the time of this posting. If you reside in a different location, a recruiter will advise on the applicable range and benefits. Pay offered will be determined based on a number of relevant business and candidate factors (e.g. education, qualifications, certifications, experience, skills, geographic location, or business needs).

PAY RANGES


British Columbia (depending on location e.g. Vancouver vs. Victoria) *$122,300 - $170,700 CAD


Pay is just one part of the overall compensation at EA.

For Canada, we offer a package of benefits including vacation (3 weeks per year to start), 10 days per year of sick time, paid top-up to EI/QPIP benefits up to 100% of base salary when you welcome a new child (12 weeks for maternity, and 4 weeks for parental/adoption leave), extended health/dental/vision coverage, life insurance, disability insurance, retirement plan to regular full-time employees. Certain roles may also be eligible for bonus and equity.

About Electronic Arts

We’re proud to have an extensive portfolio of games and experiences, locations around the world, and opportunities across EA. We value adaptability, resilience, creativity, and curiosity. From leadership that brings out your potential, to creating space for learning and experimenting, we empower you to do great work and pursue opportunities for growth.

We adopt a holistic approach to our benefits programs, emphasizing physical, emotional, financial, career, and community wellness to support a balanced life. Our packages are tailored to meet local needs and may include healthcare coverage, mental well-being support, retirement savings, paid time off, family leaves, complimentary games, and more. We nurture environments where our teams can always bring their best to what they do.

Electronic Arts is an equal opportunity employer. All employment decisions are made without regard to race, color, national origin, ancestry, sex, gender, gender identity or expression, sexual orientation, age, genetic information, religion, disability, medical condition, pregnancy, marital status, family status, veteran status, or any other characteristic protected by law. We will also consider employment qualified applicants with criminal records in accordance with applicable law. EA also makes workplace accommodations for qualified individuals with disabilities as required by applicable law.
Show more","Not Applicable","Full-time","Engineering and Information Technology","Computer Games","2 weeks ago"
4,"ML Engineer - Creator Studio","https://media.licdn.com/dms/image/v2/C560BAQHdAaarsO-eyA/company-logo_100_100/company-logo_100_100/0/1630637844948/apple_logo?e=2147483647&v=beta&t=p0JNmv2WB0EMMQgvzl9R8TaXgzEaDraGS4MWR0IawjQ","https://ca.linkedin.com/jobs/view/ml-engineer-creator-studio-at-apple-4414150976?position=4&pageNum=0&refId=eQ4YgtbbAAShexQh9mv26g%3D%3D&trackingId=wacA7rOj88%2BA8OMUzOgFQA%3D%3D","Apple","https://www.linkedin.com/company/apple?trk=public_jobs_topcard-org-name","Vancouver, British Columbia, Canada",,"Summary
Apple is where individual imaginations gather together, committing to the values that lead to great work. Every new product we build, service we create, or Apple Store experience we deliver is the result of us making each other’s ideas stronger. That happens because every one of us shares a belief that we can make something wonderful and share it with the world, changing lives for the better. It’s the diversity of our people and their thinking that inspires the innovation that runs through everything we do. When we bring everybody in, we can do the best work of our lives. Here, you’ll do more than join something — you’ll add something.

This is a great opportunity to be an early member of a new engineering team on a highly visible, highly impactful project! You will be deeply involved in developing new and innovative on-device ML and AI tools in the creative space. You will work with human interface designers, quality assurance teams, and cross-functional engineering teams to go beyond code and influence everything from user interfaces to project planning.

Description
The Creator Studio team is seeking a highly skilled ML Engineer with hands-on experience working on AI and creative tools. As an ML Engineer, you will play a key role in defining and implementing key agentic AI features in our Creator Studio applications.

Minimum Qualifications

5+ years of proven experience developing and shipping reliable, scalable, maintainable, and testable code.
Experience delivering products in Multimodal-LLMs/Foundation models, Generative AI, Machine Learning or related areas
Proven track record in training, evaluating, and deploying multimodal large language models / foundational models
Strong programming skills in Python and/or C++ and one of the deep learning toolkits such as PyTorch, JAX, or Tensorflow
Ability to work effectively in a fast-paced environment and manage multiple priorities.
Strong communication, collaboration, and project management skills with the ability to articulate technical concepts to both technical and non-technical stakeholders.
Bachelor’s Degree in Computer Science or equivalent experience.


Preferred Qualifications

Experience with Core ML, Swift, and iOS/macOS machine learning development.
Experience with Apple platforms including iOS and macOS.
Experience optimizing models and algorithms that run efficiently on resource constrained platforms
Strong patent and publication record at top conferences
Experience building APIs or frameworks.
Experience building AI tools or working on AI-adjacent projects.
Experience with the latest Swift technologies.
Experience working with media storage and playback.
Experience as a technical lead.


Pay & Benefits
At Apple, base pay is one part of our total compensation package and is determined within a range. This provides the opportunity to progress as you grow and develop within a role. The base pay range for this role is between $150,700 and $285,000, and your base pay will depend on your skills, qualifications, experience, and location.

Apple employees also have the opportunity to become an Apple shareholder through participation in Apple Inc.’s discretionary employee stock programs. Employees are eligible for discretionary restricted stock unit award recommendations, and can purchase Apple Inc. stock at a discount if voluntarily participating in Apple Inc.’s Employee Stock Purchase Plan. Participation in Apple Inc.’s discretionary stock programs is governed by Apple Inc.’s stock plans and agreements and are not part of local employment contracts or compensation.

You’ll also receive benefits including: Comprehensive medical and dental coverage, retirement benefits, a range of discounted products and free services, and for formal education related to advancing your career at Apple, reimbursement for certain educational expenses — including tuition. Additionally, this role might be eligible for discretionary bonuses or commission payments as well as relocation. Learn more about Apple Benefits

Note: Apple benefit and compensation programs are subject to eligibility requirements and other terms of the applicable plan or program.

Apple is an equal opportunity employer that is committed to inclusion and diversity. Apple provides reasonable accommodations to applicants with disabilities. Apple is a drug-free workplace.

At Apple, we believe accessibility is a fundamental human right. You’ll find that idea reflected in everything here — in our culture, our benefits and our digital tools. By welcoming as many perspectives as possible, we help you build a career where you feel like you belong.

Learn about accessibility in Apple’s workplace

Role Number: 200646237-3350


Show more","Not Applicable","Full-time","Engineering and Information Technology","Computers and Electronics Manufacturing","4 weeks ago"
